{
  "name": "Erste einfache QA Sequenz für ET Surface System der Tirol Kliniken",
  "heatingpads": "OFF",
  "meas_couch_type": "single angle",
  "sequence": [
    {
      "type": "checkpoint",
      "msg": "Sind alle Achsen gehomed und das Phantom korrekt montiert?"
    },
    {
      "type": "checkpoint",
      "msg": "Ist die Couch Rotation auf 0° und Heating Pads auf RT? - Logging wird nach dem ersten XRAY gestartet."
    },
    {
      "type": "log_checkpoint",
      "key": "raumlicht_aus",
      "mode": "yesno",
      "msg": "Raumlicht im Behandlungsraum aus? (Lichtsettings müssen bei JEDER Messung gleich sein!)"
    },

    {
      "type": "logging",
      "action": "start",
      "prefix": "ETsurface_easyQA"
    },
    {
      "type": "qa_input",
      "mode": "sphere_detection",
      "point_id": "0_Referenz",
      "msg": "Bitte Sphere Detection durchführen und initiales Isozentrum (Winston-Lutz Pointer) eingeben."
    },

    { "type": "delay", "time": 2.0 },
    { "type": "move", "H": 5.0, "speed": 20.0 },
    { "type": "delay", "time": 2.0 },
    { "type": "move", "H": 0.0, "speed": 20.0 },
    { "type": "delay", "time": 2.0 },
    { "type": "move", "H": 12.65, "speed": 20.0 },
    { "type": "move", "V": 9.41, "speed": 20.0 },
    { "type": "move", "R": 1.0, "speed": 2.0 },
    { "type": "delay", "time": 2.0 },

    {
      "type": "qa_input",
      "mode": "sphere_detection",
      "point_id": "1_endposition_d1",
      "msg": "Bitte Sphere Detection durchführen und Verschübe eingeben."
    },


    { "type": "delay", "time": 2.0 },
    { "type": "move", "H": 0.0, "speed": 20.0 },
    { "type": "move", "V": 0.0, "speed": 20.0 },
    { "type": "move", "R": 0.0, "speed": 2.0 },
    { "type": "delay", "time": 2.0 },

    {
      "type": "qa_input",
      "mode": "sphere_detection",
      "point_id": "2_zeroposition",
      "msg": "Bitte Sphere Detection durchführen und Verschübe eingeben."
    },

    {
      "type": "checkpoint",
      "msg": "Surface Tracking wieder aktiv?"
    },

    { "type": "delay", "time": 2.0 },
    { "type": "move", "H": -37.97, "speed": 20.0 },
    { "type": "move", "V": -31.23, "speed": 20.0 },
    { "type": "move", "R": 2.0, "speed": 2.0 },
    { "type": "delay", "time": 2.0 },

    {
      "type": "qa_input",
      "mode": "sphere_detection",
      "point_id": "3_endposition_d2",
      "msg": "Bitte Sphere Detection durchführen und Verschübe eingeben."
    },


    { "type": "delay", "time": 2.0 },
    { "type": "move", "H": 0.0, "speed": 20.0 },
    { "type": "move", "V": 0.0, "speed": 20.0 },
    { "type": "move", "R": 0.0, "speed": 2.0 },
    { "type": "delay", "time": 2.0 },

    {
      "type": "qa_input",
      "mode": "surface_tracking",
      "point_id": "4_zeroposition",
      "msg": "Bitte alle 6 ExacTrac Surface Tracking Werte eingeben."
    },

    {
      "type": "qa_input",
      "mode": "sphere_detection",
      "point_id": "4_zeroposition",
      "msg": "Bitte Sphere Detection durchführen und Verschübe eingeben."
    },

    {
      "type": "log_checkpoint",
      "key": "tracking_qualitaet",
      "mode": "text",
      "msg": "Tracking-Qualität / Auffälligkeiten (optional, Freitext):"
    },

    {
      "type": "logging",
      "action": "stop"
    },

    {
      "type": "checkpoint",
      "msg": "Messung wurde beendet."
    }

  ]
}